{
  "weights": {
    "reference_company": 10,
    "fuzzy_match": 5,
    "title_match": 5,
    "sector_match": 3
  },
  "fuzzy_threshold": 95.5,
  "job_title_categories": {
    "Financial Crime / MLRO / Intelligence / Investigations": [
      "financial crime",
      "aml",
      "mlro",
      "intelligence",
      "investigations",
      "crime",
      "fraud",
      "anti-money laundering",
      "anti money laundering"
    ],
    "Trust and Safety / Law Enforcement / Security / Disclosures": [
      "trust and safety",
      "law enforcement",
      "legal process",
      "content moderation",
      "incident response",
      "disclosures",
      "platform safety",
      "government request",
      "threat analyst",
      "security policy",
      "public safety",
      "digital safety"
    ]
  },
  "sector_keywords": {
    "Social Media": [
      "content",
      "social media",
      "network",
      "platform"
    ],
    "RegTech": [
      "regulatory",
      "screening",
      "fraud detection",
      "regtech",
      "kyc",
      "compliance",
      "identity verification",
      "aml"
    ],
    "Telecoms": [
      "broadband",
      "network provider",
      "telecom",
      "mobile",
      "carrier"
    ],
    "Banking": [
      "digital bank",
      "bank",
      "banking",
      "finance",
      "financial services",
      "neobank",
      "broker",
      "pay",
      "fintech",
      "exchange"
    ],
    "Gaming": [
      "video game",
      "interactive",
      "esports",
      "game",
      "gaming"
    ],
    "Crypto": [
      "crypto",
      "token",
      "exchange",
      "nft",
      "blockchain",
      "web3",
      "bitcoin",
      "ethereum",
      "wallet",
      "ledger",
      "smart contract"
    ]
  },
  "blacklist_terms": [
    "hearing",
    "academy",
    "church",
    "foundation",
    "county",
    "peace",
    "town of",
    "school",
    "ministries",
    "university"
  ],
  "sector_negatives": {
    "Social Media": [
      "human rights",
      "refugees",
      "ngo",
      "justice",
      "non-profit",
      "city council",
      "municipality",
      "training",
      "coverage",
      "advocacy"
    ],
    "RegTech": [
      "marketplace",
      "retail",
      "wholesale",
      "alibaba",
      "booking"
    ],
    "Telecoms": [
      "airways",
      "university",
      "foundation",
      "finance",
      "clinic",
      "health",
      "space",
      "ngo",
      "charity"
    ],
    "Banking": [
      "school",
      "peace",
      "church",
      "foundation",
      "pharma",
      "university",
      "ministry",
      "ngo",
      "charity"
    ],
    "Gaming": [
      "aerospace",
      "military",
      "education",
      "telecom",
      "peace",
      "research",
      "ngo",
      "charity"
    ],
    "Crypto": [
      "defense",
      "aerospace",
      "space",
      "peace",
      "school",
      "airline",
      "foundation",
      "ngo",
      "charity"
    ]
  },
  "client_name": "kodex",
  "confidence_bands": {
    "high": 12,
    "medium": 7
  },
  "exclusion_criteria": {
    "confidence_levels": [
      "Low"
    ]
  },
  "geo_scoring": {
    "preferred": [
      "united kingdom",
      "germany",
      "france",
      "netherlands",
      "italy",
      "spain",
      "sweden",
      "norway",
      "finland"
    ],
    "penalized": [
      "united states",
      "canada",
      "mexico",
      "brazil"
    ]
  },
  "priority_industries": [
      "Financial Services",
      "Banking",
      "Airlines and Aviation",
      "Internet Marketplace Platforms"
  ],
  "reference_companies_file": "Reference_Companies.csv",
  "role_seniority": {
    "senior": ["chief", "head", "vp", "director"],
    "mid": ["manager", "lead", "consultant"],
    "junior": ["analyst", "associate", "assistant"]
  },
  "excluded_companies": []
}
