{
  "weights": {
    "reference_company": 10,
    "fuzzy_match": 5,
    "title_match": 5,
    "sector_match": 3
  },
  "fuzzy_threshold": 95.5,
  "job_title_categories": {
    "Customer Experience / CX": [
      "customer experience",
      "cx",
      "client experience",
      "user experience",
      "customer journey",
      "voice of the customer",
      "experience design"
    ],
    "Marketing / Digital / Brand": [
      "marketing",
      "digital marketing",
      "brand",
      "growth marketing",
      "performance marketing",
      "vp marketing",
      "head of marketing",
      "brand manager"
    ],
    "Social Media / Engagement / Listening": [
      "social media",
      "social listening",
      "community manager",
      "engagement",
      "influencer",
      "social strategist",
      "social media manager"
    ],
    "Customer Insights / Research / Analytics": [
      "customer insights",
      "market research",
      "insight",
      "data analyst",
      "consumer insights",
      "customer intelligence",
      "voice of customer",
      "analytics"
    ]
  },
  "sector_keywords": {
    "Retail & Ecommerce": [
      "retail",
      "ecommerce",
      "consumer goods",
      "fashion",
      "apparel",
      "grocery",
      "supermarket",
      "store",
      "online shopping",
      "luxury",
      "fmcg",
      "e-tail"
    ],
    "Hospitality & Travel": [
      "hotel",
      "resort",
      "hospitality",
      "travel",
      "airlines",
      "tourism",
      "accommodation",
      "lodging"
    ],
    "Food & Beverage": [
      "restaurant",
      "food",
      "beverage",
      "cafe",
      "fast food",
      "dining",
      "bar",
      "brewery"
    ],
    "Media & Entertainment": [
      "media",
      "streaming",
      "entertainment",
      "tv",
      "music",
      "broadcast",
      "cinema",
      "video"
    ],
    "Consumer Electronics": [
      "electronics",
      "devices",
      "smartphone",
      "tv",
      "appliance",
      "gadgets"
    ],
    "Automotive": [
      "automotive",
      "vehicle",
      "car",
      "motor",
      "auto"
    ],
    "Telecom": [
      "telecom",
      "mobile",
      "network",
      "carrier",
      "broadband"
    ],
    "Utilities": [
      "utility",
      "gas",
      "electric",
      "energy",
      "power",
      "water"
    ]
  },
  "blacklist_terms": [
    "hearing",
    "academy",
    "church",
    "foundation",
    "county",
    "peace",
    "town of",
    "school",
    "ministries",
    "university"
  ],
  "sector_negatives": {
    "Social Media": [
      "law enforcement",
      "corrections",
      "police",
      "justice",
      "prison",
      "military"
    ],
    "Retail & Ecommerce": [
      "university",
      "school",
      "municipality",
      "town",
      "county",
      "public sector"
    ],
    "Utilities": [
      "church",
      "ngo",
      "humanitarian",
      "non-profit",
      "academy"
    ],
    "Banking": [
      "school",
      "university",
      "academy",
      "church",
      "ngo",
      "non-profit",
      "foundation"
    ],
    "Telecoms": [
      "airlines",
      "defense",
      "military",
      "space",
      "university",
      "academy"
    ]
  },
  "client_name": "konnect_insights",
  "confidence_bands": {
    "high": 12,
    "medium": 7
  },
  "exclusion_criteria": {
    "confidence_levels": [
      "Low"
    ]
  },
  "geo_scoring": {
    "preferred": [
      "united kingdom",
      "germany",
      "france",
      "netherlands",
      "italy",
      "spain",
      "sweden",
      "norway",
      "finland",
      "ireland",
      "belgium",
      "denmark",
      "switzerland",
      "austria",
      "portugal",
      "czech republic",
      "poland",
      "hungary",
      "romania",
      "greece"
    ],
    "penalized": [
      "china",
      "india",
      "japan",
      "south korea",
      "australia",
      "russia",
      "south africa",
      "singapore",
      "hong kong",
      "nigeria",
      "united arab emirates",
      "saudi arabia",
      "pakistan",
      "brazil"
    ]
  },
  "role_seniority": {
    "senior": [
      "head",
      "chief",
      "director",
      "vp",
      "senior",
      "lead"
    ],
    "mid": [
      "manager",
      "consultant",
      "specialist"
    ],
    "junior": [
      "analyst",
      "associate",
      "intern",
      "assistant"
    ]
  },
  "excluded_companies": [
    "brandwatch",
    "sprinklr",
    "sprout social",
    "hootsuite",
    "talkwalker",
    "zoho social",
    "falcon.io",
    "socialbakers",
    "agorapulse",
    "mention",
    "sendible",
    "digimind",
    "netbase quid",
    "meltwater"
  ],
  "priority_industries": [
      "Accomodation Services",
      "Airlines and Aviation",
      "Amusement Parks and Arcades",
      "Apparel and Fashion",
      "Apparel & Fashion",
      "Artists and Writers",
      "Automotive",
      "Aviation & Aerospace",
      "Aviation and Aerospace",
      "Banking",
      "Biomass Electric Power Generation",
      "Capital Markets",
      "Circuses and Magic Shows",
      "Computer Games",
      "Consumer Electronics",
      "Consumer Goods",
      "Consumer Goods Rental",
      "Consumer Services",
      "Cosmetics",
      "Dance Companies",
      "E-Learning Providers",
      "Electric Power Generation",
      "Electric Power Transmission, Control, and Distribution",
      "Entertainment",
      "Entertainment Providers",
      "Equipment Rental Services",
      "Events Services",
      "Executive Search Services",
      "Food & Beverages",
      "Food and Beverage Retail",
      "Fossil Fuel Electric Power Generation",
      "Fundraising",
      "Furniture",
      "Gambling Facilities and Casinos",
      "Geothermal Electric Power Generation",
      "Golf Courses and Country Clubs",
      "Health, Wellness and Fitness",
      "Historical Sites",
      "Hospitality",
      "Hotels and Motels",
      "Hotels & Motels",
      "Hydroelectric Power Generation",
      "Insurance",
      "Insurance Carriers",
      "Leasing Residential Real Estate",
      "Leisure, Travel & Tourism",
      "Maritime",
      "Maritime Transportation",
      "Marketing Services",
      "Media and Telecommunications",
      "Mobile Computing Software Products",
      "Mobile Food Services",
      "Mobile Gaming Apps",
      "Movies and Sound Recording",
      "Movies & Sound Recording",
      "Movies, Videos and Sound",
      "Museums",
      "Museums, Historical Sites, and Zoos",
      "Museums, Historical Sites, & Zoos",
      "Musicians",
      "Natural Gas Distribution",
      "Newspaper Publishing",
      "Nuclear Electric Power Generation",
      "Oil and Gas",
      "Online Audio and Video Media",
      "Online Audio & Video Media",
      "Online Media",
      "Online and Mail Order Retail",
      "Performing Arts",
      "Performing Arts and Spectator Sports",
      "Postal Services",
      "Racetracks",
      "Radio and Television Broadcasting",
      "Rail Transportation",
      "Real Estate",
      "Real Estate and Equipment Rental Services",
      "Recreational Facilities",
      "Renewable Energy Power Generation",
      "Renewables & Environment",
      "Restaurants",
      "Retail",
      "Retail Apparel and Fashion",
      "Retail Apparel & Fashion",
      "Retail Appliances, Electrical, and Electronic Equipment",
      "Retail Art Dealers",
      "Retail Art Supplies",
      "Retail Books and Printed News",
      "Retail Building Materials and Garden Equipment",
      "Retail Florists",
      "Retail Furniture and Home Furnishings",
      "Retail Furniture & Home Furnishings",
      "Retail Gasoline",
      "Retail Groceries",
      "Retail Health and Personal Care Products",
      "Retail Health & Personal Care Products",
      "Retail Luxury Goods and Jewelry",
      "Retail Motor Vehicles",
      "Retail Musical Instruments",
      "Retail Office Equipment",
      "Retail Office Supplies and Gifts",
      "Retail Pharmacies",
      "Retail Recyclable Materials & Used Merchandise",
      "Sightseeing Transportation",
      "Skiing Facilities",
      "Social Networking Platforms",
      "Solar Electric Power Generation",
      "Spectator Sports",
      "Sporting Goods",
      "Sports Teams and Clubs",
      "Steam and Air-Conditioning Supply",
      "Taxi and Limousine Services",
      "Telecommunications",
      "Telecommunications Carriers",
      "Theater Companies",
      "Travel Arrangements",
      "Urban Transit Services",
      "Utilities",
      "Water Supply and Irrigation Systems",
      "Water, Waste, Steam, and Air Conditioning Services",
      "Wellness and Fitness Services",
      "Wind Electric Power Generation",
      "Zoos and Botanical Gardens",
      "Broadcast Media Production and Distribution",
      "Civic and Social Organizations",
      "Community Services",
      "Food and Beverage Services",
      "Ground Passenger Transportation",
      "Media & Telecommunications",
      "Motor Vehicle Manufacturing"
  ],
  "reference_companies_file": "Reference_Companies.csv"
}
